{"schema_version":"1.0.0","id":"builtin.autonomy-fallback-stopping-delegation","version":"1.0.0","rules":[
  {"id":"autonomy.in-scope","category":"autonomy","outcome":"continue","risk_score":25,"explanation":"Continue only while useful work remains within explicit authority.","conditions":[{"field":"category","operator":"equals","value":"autonomy"}]},
  {"id":"autonomy.classify","category":"autonomy","outcome":"continue","risk_score":25,"explanation":"Resolve user intent and active phase, then classify the requested action before selecting the smallest authorized next step.","conditions":[{"field":"category","operator":"equals","value":"autonomy"}]},
  {"id":"autonomy.approval","category":"autonomy","outcome":"clarify","risk_score":60,"explanation":"External, destructive, costly, purchase, permission-sensitive, or scope-expanding actions require applicable confirmation.","conditions":[{"field":"category","operator":"equals","value":"autonomy"}]},
  {"id":"autonomy.layers","category":"autonomy","outcome":"continue","risk_score":25,"explanation":"Preserve research, design, implementation, review, and external-coordination boundaries; one phase never authorizes later phases.","conditions":[{"field":"category","operator":"equals","value":"autonomy"}]},
  {"id":"fallback.bounded","category":"fallback","outcome":"warn","risk_score":25,"explanation":"Use a bounded fallback without repeating failed work.","conditions":[{"field":"category","operator":"equals","value":"fallback"}]},
  {"id":"fallback.attempts","category":"fallback","outcome":"warn","risk_score":25,"explanation":"Try at most two meaningful fallbacks for empty, partial, or suspicious results unless a stricter bound applies.","conditions":[{"field":"category","operator":"equals","value":"fallback"}]},
  {"id":"stopping.exhausted","category":"stopping","outcome":"block","risk_score":75,"explanation":"Stop when bounds, useful work, or authority are exhausted.","conditions":[{"field":"category","operator":"equals","value":"stopping"}]},
  {"id":"stopping.supported","category":"stopping","outcome":"continue","risk_score":10,"explanation":"Stop when the core request is supported; correctness, evidence, calculations, citations, safety, and validation outrank fewer calls.","conditions":[{"field":"category","operator":"equals","value":"stopping"}]},
  {"id":"stopping.checkpoint","category":"stopping","outcome":"warn","risk_score":25,"explanation":"Recommend a compact continuation only from observed repeated loops, large carried results, or a host-exposed approaching limit.","conditions":[{"field":"category","operator":"equals","value":"stopping"}]},
  {"id":"stopping.context-efficiency","category":"stopping","outcome":"continue","risk_score":10,"explanation":"Use relevant tools, deduplicated retrieval, smallest sufficient results, and one synthesis without weakening required evidence or validation.","conditions":[{"field":"category","operator":"equals","value":"stopping"}]},
  {"id":"delegation.none","category":"delegation","outcome":"continue","risk_score":10,"explanation":"Do not delegate.","conditions":[{"field":"delegation_policy","operator":"equals","value":"none"}]},
  {"id":"delegation.user-requested","category":"delegation","outcome":"clarify","risk_score":50,"explanation":"Delegate only after an explicit user request and capability check.","conditions":[{"field":"delegation_policy","operator":"equals","value":"user_requested_only"}]},
  {"id":"delegation.bounded","category":"delegation","outcome":"clarify","risk_score":50,"explanation":"Bounded delegation requires independent work, known capability, agent/depth/concurrency limits, aggregation, completion criteria, and stop limits.","conditions":[{"field":"delegation_policy","operator":"equals","value":"bounded"}]},
  {"id":"delegation.no-recursion","category":"delegation","outcome":"block","risk_score":80,"explanation":"Recursive fanout is denied unless explicitly authorized; pass only minimal task-specific context.","conditions":[{"field":"delegation_policy","operator":"equals","value":"bounded"}]}
]}
