{"schema_version":"1.0.0","id":"builtin.tool-retrieval-ptc","version":"1.0.0","rules":[
  {"id":"tool.direct","category":"tool_routing","outcome":"continue","risk_score":10,"explanation":"Use a direct bounded tool when it fully covers the request.","conditions":[{"field":"category","operator":"equals","value":"tool_routing"},{"field":"capability_state","operator":"equals","value":"supported"}]},
  {"id":"tool.unknown","category":"tool_routing","outcome":"clarify","risk_score":50,"explanation":"Unknown tool capability cannot be treated as supported.","conditions":[{"field":"category","operator":"equals","value":"tool_routing"},{"field":"capability_state","operator":"equals","value":"unknown"}]},
  {"id":"tool.relevant-only","category":"tool_routing","outcome":"continue","risk_score":10,"explanation":"Expose only task-relevant tools with purpose, use conditions, typed returns, and errors stated.","conditions":[{"field":"category","operator":"equals","value":"tool_routing"}]},
  {"id":"tool.order","category":"tool_routing","outcome":"continue","risk_score":10,"explanation":"Resolve prerequisite discovery, retrieval, and validation first; parallelize independent reads and sequence dependent actions.","conditions":[{"field":"category","operator":"equals","value":"tool_routing"}]},
  {"id":"tool.synthesize","category":"tool_routing","outcome":"continue","risk_score":10,"explanation":"Synthesize bounded read results once before acting; do not repeat completed work or silently change routes.","conditions":[{"field":"category","operator":"equals","value":"tool_routing"}]},
  {"id":"retrieval.bounded","category":"retrieval","outcome":"continue","risk_score":10,"explanation":"Retrieve only evidence needed for the current decision and cite its sanitized source.","conditions":[{"field":"category","operator":"equals","value":"retrieval"}]},
  {"id":"retrieval.first-search","category":"retrieval","outcome":"continue","risk_score":10,"explanation":"For ordinary questions, begin with one broad search using short discriminative terms.","conditions":[{"field":"category","operator":"equals","value":"retrieval"}]},
  {"id":"retrieval.expand-only","category":"retrieval","outcome":"continue","risk_score":10,"explanation":"Retrieve again only for a missing required fact, owner, date, identifier, source, unread artifact, exhaustive request, or unsupported material claim.","conditions":[{"field":"category","operator":"equals","value":"retrieval"}]},
  {"id":"retrieval.citations","category":"retrieval","outcome":"continue","risk_score":10,"explanation":"Cite only retrieved evidence at supported claims; label inference, conflicts, missing evidence, and creative wording.","conditions":[{"field":"category","operator":"equals","value":"retrieval"}]},
  {"id":"ptc.capability","category":"ptc","outcome":"clarify","risk_score":50,"explanation":"PTC routing requires an observed supported host capability.","conditions":[{"field":"category","operator":"equals","value":"ptc"},{"field":"capability_state","operator":"not_equals","value":"supported"}]},
  {"id":"ptc.eligible","category":"ptc","outcome":"continue","risk_score":10,"explanation":"Use PTC only for bounded deterministic read-only transforms with exact schemas, evidence, concurrency, retry, stop, and one handoff limits.","conditions":[{"field":"category","operator":"equals","value":"ptc"},{"field":"capability_state","operator":"equals","value":"supported"}]},
  {"id":"ptc.direct-exclusions","category":"ptc","outcome":"warn","risk_score":25,"explanation":"Keep one-call, small-output, judgment-changing, approval, citation, native-artifact, side-effecting, and final-validation work direct.","conditions":[{"field":"category","operator":"equals","value":"ptc"}]}
]}
